{
  "schemaVersion": "1.0",
  "id": "route-id3cvw",
  "provider": "local",
  "isSampleData": true,
  "generatedAt": "2026-10-23T12:00:00.000Z",
  "accessible": true,
  "from": {
    "name": "Library",
    "point": {
      "lat": 56.14582,
      "lng": -3.92068
    },
    "destinationId": "building:library"
  },
  "to": {
    "name": "Seminar room 1.01 (sample)",
    "point": {
      "lat": 56.14469,
      "lng": -3.92008,
      "buildingId": "cottrell",
      "floorId": "cottrell-1",
      "level": 1
    },
    "destinationId": "room:cottrell-1-101"
  },
  "distanceMetres": 255,
  "durationSeconds": 276,
  "steps": [
    {
      "index": 0,
      "type": "walk",
      "instruction": "Head south",
      "location": {
        "lat": 56.14582,
        "lng": -3.92068
      },
      "path": [
        {
          "lat": 56.14582,
          "lng": -3.92068
        },
        {
          "lat": 56.1456,
          "lng": -3.92068
        }
      ],
      "distanceMetres": 24.5,
      "durationSeconds": 22
    },
    {
      "index": 1,
      "type": "turn",
      "turn": "left",
      "instruction": "Turn left onto Main walkway",
      "location": {
        "lat": 56.1456,
        "lng": -3.92068
      },
      "path": [
        {
          "lat": 56.1456,
          "lng": -3.92068
        },
        {
          "lat": 56.1456,
          "lng": -3.9197
        }
      ],
      "distanceMetres": 60.7,
      "durationSeconds": 55
    },
    {
      "index": 2,
      "type": "walk",
      "instruction": "Take the Cottrell ramp (step-free)",
      "location": {
        "lat": 56.1456,
        "lng": -3.9197
      },
      "path": [
        {
          "lat": 56.1456,
          "lng": -3.9197
        },
        {
          "lat": 56.14515,
          "lng": -3.91975
        },
        {
          "lat": 56.14465,
          "lng": -3.91989
        }
      ],
      "distanceMetres": 106.4,
      "durationSeconds": 97
    },
    {
      "index": 3,
      "type": "enter-building",
      "buildingId": "cottrell",
      "instruction": "Enter Cottrell Building by the east entrance",
      "location": {
        "lat": 56.14465,
        "lng": -3.91989,
        "buildingId": "cottrell",
        "floorId": "cottrell-0",
        "level": 0
      },
      "path": [
        {
          "lat": 56.14465,
          "lng": -3.91989,
          "buildingId": "cottrell",
          "floorId": "cottrell-0",
          "level": 0
        },
        {
          "lat": 56.14465,
          "lng": -3.91995,
          "buildingId": "cottrell",
          "floorId": "cottrell-0",
          "level": 0
        },
        {
          "lat": 56.14465,
          "lng": -3.92008,
          "buildingId": "cottrell",
          "floorId": "cottrell-0",
          "level": 0
        },
        {
          "lat": 56.14465,
          "lng": -3.9203,
          "buildingId": "cottrell",
          "floorId": "cottrell-0",
          "level": 0
        }
      ],
      "distanceMetres": 25.4,
      "durationSeconds": 23
    },
    {
      "index": 4,
      "type": "turn",
      "turn": "right",
      "instruction": "Turn right to the lift",
      "location": {
        "lat": 56.14465,
        "lng": -3.9203,
        "buildingId": "cottrell",
        "floorId": "cottrell-0",
        "level": 0
      },
      "path": [
        {
          "lat": 56.14465,
          "lng": -3.9203,
          "buildingId": "cottrell",
          "floorId": "cottrell-0",
          "level": 0
        },
        {
          "lat": 56.14474,
          "lng": -3.9203,
          "buildingId": "cottrell",
          "floorId": "cottrell-0",
          "level": 0
        }
      ],
      "distanceMetres": 10,
      "durationSeconds": 9
    },
    {
      "index": 5,
      "type": "change-floor",
      "instruction": "Take the lift to Floor 2",
      "location": {
        "lat": 56.14474,
        "lng": -3.9203,
        "buildingId": "cottrell",
        "floorId": "cottrell-0",
        "level": 0
      },
      "path": [
        {
          "lat": 56.14474,
          "lng": -3.9203,
          "buildingId": "cottrell",
          "floorId": "cottrell-0",
          "level": 0
        },
        {
          "lat": 56.14474,
          "lng": -3.9203,
          "buildingId": "cottrell",
          "floorId": "cottrell-1",
          "level": 1
        }
      ],
      "floorChange": {
        "via": "lift",
        "fromLevel": 0,
        "toLevel": 1,
        "fromFloorId": "cottrell-0",
        "toFloorId": "cottrell-1",
        "toFloorName": "Floor 2"
      },
      "distanceMetres": 0,
      "durationSeconds": 45
    },
    {
      "index": 6,
      "type": "walk",
      "instruction": "Walk along the corridor",
      "location": {
        "lat": 56.14474,
        "lng": -3.9203,
        "buildingId": "cottrell",
        "floorId": "cottrell-1",
        "level": 1
      },
      "path": [
        {
          "lat": 56.14474,
          "lng": -3.9203,
          "buildingId": "cottrell",
          "floorId": "cottrell-1",
          "level": 1
        },
        {
          "lat": 56.14465,
          "lng": -3.9203,
          "buildingId": "cottrell",
          "floorId": "cottrell-1",
          "level": 1
        }
      ],
      "distanceMetres": 10,
      "durationSeconds": 9
    },
    {
      "index": 7,
      "type": "turn",
      "turn": "left",
      "instruction": "Turn left",
      "location": {
        "lat": 56.14465,
        "lng": -3.9203,
        "buildingId": "cottrell",
        "floorId": "cottrell-1",
        "level": 1
      },
      "path": [
        {
          "lat": 56.14465,
          "lng": -3.9203,
          "buildingId": "cottrell",
          "floorId": "cottrell-1",
          "level": 1
        },
        {
          "lat": 56.14465,
          "lng": -3.92008,
          "buildingId": "cottrell",
          "floorId": "cottrell-1",
          "level": 1
        }
      ],
      "distanceMetres": 13.6,
      "durationSeconds": 12
    },
    {
      "index": 8,
      "type": "turn",
      "turn": "left",
      "instruction": "Turn left through the door",
      "location": {
        "lat": 56.14465,
        "lng": -3.92008,
        "buildingId": "cottrell",
        "floorId": "cottrell-1",
        "level": 1
      },
      "path": [
        {
          "lat": 56.14465,
          "lng": -3.92008,
          "buildingId": "cottrell",
          "floorId": "cottrell-1",
          "level": 1
        },
        {
          "lat": 56.14469,
          "lng": -3.92008,
          "buildingId": "cottrell",
          "floorId": "cottrell-1",
          "level": 1
        }
      ],
      "distanceMetres": 4.4,
      "durationSeconds": 4
    },
    {
      "index": 9,
      "type": "arrive",
      "instruction": "You have arrived at Seminar room 1.01 (sample), Floor 2",
      "location": {
        "lat": 56.14469,
        "lng": -3.92008,
        "buildingId": "cottrell",
        "floorId": "cottrell-1",
        "level": 1
      },
      "path": [
        {
          "lat": 56.14469,
          "lng": -3.92008,
          "buildingId": "cottrell",
          "floorId": "cottrell-1",
          "level": 1
        }
      ],
      "distanceMetres": 0,
      "durationSeconds": 0
    }
  ]
}
